{
  "schemaVersion": "1.0.0", "sceneId": "scene-baseline", "sceneRevision": 0,
  "units": "SI", "coordinateSystem": "right-handed-y-up-minus-z-forward", "seed": 1,
  "gravityMps2": [0, -9.81, 0],
  "objects": [{"id": "ball", "shape": "sphere", "dimensionsM": [0.2, 0.2, 0.2], "positionM": [0, 1, 0], "orientationQuaternion": [0, 0, 0, 1], "mode": "dynamicGravity", "massKg": 1, "friction": 0.5, "restitution": 0.3, "physicsMaterialId": "physics-demo", "acousticMaterialId": "synthetic-demo", "acousticRole": "none"}],
  "sources": [{"id": "source-ball", "objectId": "ball", "signalId": "sine-440", "mode": "continuous", "gainDbfs": -20, "playing": false}],
  "listener": {"id": "listener-main", "positionM": [0, 1.6, 2], "orientationQuaternion": [0, 0, 0, 1], "attachment": "independent"}
}
